{
  "id": "snsf",
  "name": "Swiss National Science Foundation",
  "sites": [
    {
      "host": "www.snf.ch",
      "unit": "Swiss National Science Foundation",
      "seeds": [
        "https://www.snf.ch/en/0J84YIJ4f5K9LaQl/funding/maps-multilateral-academic-projects",
        "https://www.snf.ch/en/2DTdRMlWG6LgpNjL/funding/programmes/bilateral-programmes-south-african",
        "https://www.snf.ch/en/2hJaLDgvNdjNq6zd/funding/programmes/bilateral-programmes-russia",
        "https://www.snf.ch/en/3N4AueGHbJmnq5BR/funding/projects/weave-lead-agency-tyrol",
        "https://www.snf.ch/en/3QbAMu814J05tGSC/funding/programmes/bilateral-programmes",
        "https://www.snf.ch/en/4wbazM3qTDVahZSq/funding/projects/weave-sweden",
        "https://www.snf.ch/en/5ZlDIACY6ExU17v7/funding/human-frontier-science-program",
        "https://www.snf.ch/en/5uprjjpRrLplXMYH/funding/ukrainian-swiss-joint-research-programme",
        "https://www.snf.ch/en/6NiRBOzRU75VH5as/funding/projects/weave-lead-agency",
        "https://www.snf.ch/en/75vVX8QqrZjp4miU/funding/projects/marvis",
        "https://www.snf.ch/en/8EWqXT6CZ7wuAJUq/funding/programmes/spark",
        "https://www.snf.ch/en/AiAl5v5Ip9gRatly/funding/programmes/bilateral-programmes-vietnamese",
        "https://www.snf.ch/en/B4Ua6LK1v7a0QDqA/funding/projects/weave-lead-agency-poland",
        "https://www.snf.ch/en/BK8U9pDnWcCn1I1q/funding/projects/weave-lead-agency-austria",
        "https://www.snf.ch/en/CxcoLbDNRaUwHIoH/funding/projects/weave",
        "https://www.snf.ch/en/DGCP4SuM4eU2O1bz/funding/careers/eccellenza",
        "https://www.snf.ch/en/Dw4VsJIQI5XZLLh5/funding/programmes/enlargement-contributions-romania",
        "https://www.snf.ch/en/ELxP53n5RBBa08a2/funding/programmes/national-research-programmes",
        "https://www.snf.ch/en/EpxgsoxjZBQv6id1/funding/programmes/cost",
        "https://www.snf.ch/en/EuOIfK68CLCBPGnv/funding/infrastructures/biolink",
        "https://www.snf.ch/en/FJBJ8XGQ1tjG8J8w/funding/programmes/national-centres-of-competence-in-research",
        "https://www.snf.ch/en/FJkAfzH5K7xnadWg/funding/projects/digital-lives",
        "https://www.snf.ch/en/FLNYcUnLM0hzv1La/funding/supplementary-measures/reduction-of-teaching-commitments",
        "https://www.snf.ch/en/Fb19rz5iYXpbuPyy/funding/programmes/sor4d-programme",
        "https://www.snf.ch/en/Gc965aD10MCUHTn3/funding/science-communication/open-access-book-chapters",
        "https://www.snf.ch/en/GfJBx9Sz1R1KjE40/funding/projects/weave-lead-agency-belgium-wallonia",
        "https://www.snf.ch/en/H7ntK31SrKT2dHXX/funding/projects/weave-lead-agency-corona-europe",
        "https://www.snf.ch/en/HsAGC8vPSGqxcAVm/funding/science-communication/scholars-at-risk-grants",
        "https://www.snf.ch/en/HzVMPWm96mz69ZJ8/funding/programmes/sinergia",
        "https://www.snf.ch/en/IGI4IbBgyNXLUqdU/funding/snsf-consolidator-grants",
        "https://www.snf.ch/en/JPaqmAevz4ZrQCpC/funding/programmes/enlargement-contributions",
        "https://www.snf.ch/en/JnT2xEAERCgO8qQc/funding/science-communication/agora",
        "https://www.snf.ch/en/KZeT6EA06Cqwe9Yz/funding/programmes/enlargement-contributions-croatia",
        "https://www.snf.ch/en/N18L3oGWomTSSGkF/funding/careers/ambizione",
        "https://www.snf.ch/en/N1jbowApPMqoO2et/funding/projects/weave-lead-agency-croatia",
        "https://www.snf.ch/en/NAxx00c7O1jdxiok/funding/projects/weave-lead-agency-saopaulo",
        "https://www.snf.ch/en/NxCwX7BqowAsMShZ/funding/infrastructures/use-of-infrastructure",
        "https://www.snf.ch/en/O4kjNy462OJRd5gX/funding/projects/weave-lead-agency",
        "https://www.snf.ch/en/PKTxwhstPAP8CKOd/funding/infrastructures/requip",
        "https://www.snf.ch/en/RDtCf0PZrKDKwsI6/funding/careers/md-phd-programme",
        "https://www.snf.ch/en/RPgM7YpVD9FeC9xT/funding/projects/weave-lead-agency-spain",
        "https://www.snf.ch/en/SSHTwon4N4v9R79P/funding/horizon-europe-advanced-grants",
        "https://www.snf.ch/en/SXw5p2SWrG7IDtpJ/funding/australian-swiss-joint-research-programme",
        "https://www.snf.ch/en/Shcb21B7T7hmJBwM/funding/projects/lead-agency-process",
        "https://www.snf.ch/en/UKQxILyeulyH9qfi/funding/programmes/bilateral-programmes-indo",
        "https://www.snf.ch/en/WAvYcY7awAUGolST/funding/projects/project-funding",
        "https://www.snf.ch/en/X7wQPXdwrBsOZD0f/funding/careers/practice-to-science",
        "https://www.snf.ch/en/XIZpfY3iVS5KRRoD/funding/careers/postdoc-mobility",
        "https://www.snf.ch/en/YA2SxeDV03G25gyJ/funding/programmes/longitudinal-studies",
        "https://www.snf.ch/en/YyNH009fxuDiGk7U/funding/careers/docch",
        "https://www.snf.ch/en/Z2i6FpYa5sJNrKVu/funding/projects/weave-lead-agency-germany",
        "https://www.snf.ch/en/bO9pxULJJ3ZuTDjL/funding/politics-courses-for-researchers",
        "https://www.snf.ch/en/cwEW5KbgFWs6YNmW/funding/supplementary-measures/money-follows-researcher",
        "https://www.snf.ch/en/d09nVyBuCfh8ZfOl/funding/horizon-europe-quantum",
        "https://www.snf.ch/en/dGjOroUw8VHlDSHW/funding/swiss-quantum-call-2024",
        "https://www.snf.ch/en/fvnejfErYvg7ShsD/funding/infrastructures/roadmap",
        "https://www.snf.ch/en/gCCYPmblxBCAFNZg/funding/supplementary-measures/gender-equality-grant",
        "https://www.snf.ch/en/hTBUS7CLoDTMortt/funding/projects/weave-lead-agency-slovenia",
        "https://www.snf.ch/en/hyaJhBlfsmd618fO/funding/programmes/iict",
        "https://www.snf.ch/en/ijfRcC56ku1bPQbt/funding/projects/weave-lead-agency-southafrica",
        "https://www.snf.ch/en/j3eRKmgqIrepqJnT/funding/projects/weave-lead-agency-icis",
        "https://www.snf.ch/en/jZNHb3DeXyswc1Oa/funding/projects/weave-lead-agency",
        "https://www.snf.ch/en/kTaVqfi7ivYBn5Tk/funding/programmes/bilateral-programmes-korean",
        "https://www.snf.ch/en/lNUOvTWr8ynn7uMp/funding/new-frontiers-in-research-fund",
        "https://www.snf.ch/en/lO9DjcNKaVRr5CyW/funding/programmes/bilateral-programmes-japanese",
        "https://www.snf.ch/en/m1BuKkhqcSedG8Ix/funding/programmes/bridge",
        "https://www.snf.ch/en/m1NtWp4nTELQixlu/funding/horizon-europe-swiss-postdoctoral-fellowships",
        "https://www.snf.ch/en/mKVdFSoD7dwtinOR/funding/supplementary-measures/mobility-grants-in-projects",
        "https://www.snf.ch/en/nlghrhyzbD90TM9D/funding/programmes/spirit",
        "https://www.snf.ch/en/oCvaZrFZtKcxsr6J/funding/supplementary-measures/protected-research-time-clinicians",
        "https://www.snf.ch/en/ovil4ntsX4h2jEiU/funding/supplementary-measures/flexibility-grant",
        "https://www.snf.ch/en/ozKDc97zu0ZBwCfJ/funding/science-communication/open-access-article-publications",
        "https://www.snf.ch/en/p4VdCV0yjzwyWAjq/funding/programmes/r4d-programme",
        "https://www.snf.ch/en/pN10glmaRWFEWvs1/funding/programmes/coronavirus",
        "https://www.snf.ch/en/plHxPeHWHiXwvn9e/funding/second-swiss-contribution",
        "https://www.snf.ch/en/q8SXtOU3wXpLW7qZ/funding/programmes/european-partnerships",
        "https://www.snf.ch/en/soMWfibVDpNMVR36/funding/careers/prima",
        "https://www.snf.ch/en/tIdbT9nXdEPFnea9/funding/programmes/enlargement-contributions-bulgaria",
        "https://www.snf.ch/en/tdRSvk5gFpAQG1cB/funding/projects/weave-lead-agency-luxembourg",
        "https://www.snf.ch/en/uDrZ9XdnVZNYvICh/funding/promys",
        "https://www.snf.ch/en/uFVQpBCWSS0IITqo/funding/programmes/bilateral-programmes-sino",
        "https://www.snf.ch/en/uFmFFmMJGrnt1t49/funding/science-communication/open-access-book-publications",
        "https://www.snf.ch/en/uRl33AS5xngz6MO6/funding/projects/international-co-investigator-scheme",
        "https://www.snf.ch/en/ustwcin8DxoxxHGc/funding/projects-on-health-and-wellbeing",
        "https://www.snf.ch/en/vHmVpRYYUJYwO6On/funding/science-communication/media-courses",
        "https://www.snf.ch/en/w728UqT1Yw256Mz2/funding/careers/snsf-starting-grants",
        "https://www.snf.ch/en/wSd33rwrhn7Q16jI/funding/science-communication/scientific-exchanges",
        "https://www.snf.ch/en/wh5PIz5bIuRn0TYY/funding/programmes/bilateral-programmes-brazilian",
        "https://www.snf.ch/en/wwgU3Mibtzfd9yCJ/funding/projects/weave-lead-agency-czech-republic",
        "https://www.snf.ch/en/yFzYwz7vw0EtgxcU/funding/infrastructures/editions",
        "https://www.snf.ch/en/yZyEJhumi0SmWZ1r/funding/infrastructures/flare",
        "https://www.snf.ch/en/ybWTNmWVwRizN9V4/funding/sciex-scientific-exchange-between-switzerland-and-bulgaria",
        "https://www.snf.ch/en/yi4Lb7IjMXJmkCFL/funding/science-communication/communication-courses-for-researchers",
        "https://www.snf.ch/en/zNuj1R3Y0K2NCI64/funding/projects/weave-lead-agency-belgium-flanders"
      ]
    }
  ],
  "crawl": {
    "max_pages_per_site": 120,
    "delay_s": 1.0,
    "max_depth": 0
  },
  "page_types": [
    {
      "kind": "call",
      "url_pattern": "^https://www\\.snf\\.ch/en/[A-Za-z0-9]+/funding/"
    },
    {
      "kind": "listing",
      "url_pattern": "^https://www\\.snf\\.ch/"
    }
  ]
}
